{
  "$schema": "http://json-schema.org/draft-07/schema#",
  "$id": "https://cyclonedx.org/schema/bom-1.5-ml-bom.schema.json",
  "title": "CycloneDX ML-BOM Extension",
  "description": "CycloneDX Bill of Materials v1.5 with Machine Learning Bill of Materials (ML-BOM) extension. Covers standard BOM fields plus ML-specific properties for model metadata, dataset references, and agent tool inventories.",
  "type": "object",
  "required": ["bomFormat", "specVersion", "version"],
  "additionalProperties": true,
  "properties": {
    "bomFormat": {
      "type": "string",
      "enum": ["CycloneDX"]
    },
    "specVersion": {
      "type": "string",
      "enum": ["1.4", "1.5", "1.6"]
    },
    "version": {
      "type": "integer",
      "minimum": 1
    },
    "serialNumber": {
      "type": "string",
      "pattern": "^urn:uuid:[0-9a-f]{8}-[0-9a-f]{4}-[0-9a-f]{4}-[0-9a-f]{4}-[0-9a-f]{12}$"
    },
    "metadata": {
      "type": "object",
      "additionalProperties": true,
      "properties": {
        "timestamp": {
          "type": "string",
          "pattern": "^\\d{4}-\\d{2}-\\d{2}T\\d{2}:\\d{2}:\\d{2}(\\.\\d+)?(Z|[+-]\\d{2}:\\d{2})$"
        },
        "tools": {
          "type": "array",
          "items": {
            "type": "object",
            "properties": {
              "vendor": { "type": "string" },
              "name": { "type": "string" },
              "version": { "type": "string" }
            }
          }
        },
        "component": {
          "type": "object",
          "properties": {
            "type": {
              "type": "string",
              "enum": ["application", "library", "framework", "container", "operating-system", "device", "firmware", "file", "machine-learning-model", "data", "ai-agent"]
            },
            "name": { "type": "string" },
            "version": { "type": "string" },
            "bom-ref": { "type": "string" },
            "purl": { "type": "string" },
            "properties": {
              "type": "array",
              "items": {
                "type": "object",
                "properties": {
                  "name": { "type": "string" },
                  "value": { "type": "string" }
                }
              }
            }
          },
          "required": ["type", "name"]
        }
      }
    },
    "components": {
      "type": "array",
      "items": {
        "type": "object",
        "properties": {
          "type": {
            "type": "string",
            "enum": ["application", "library", "framework", "container", "operating-system", "device", "firmware", "file", "machine-learning-model", "data", "ai-agent"]
          },
          "name": { "type": "string" },
          "version": { "type": "string" },
          "bom-ref": { "type": "string" },
          "purl": { "type": "string" },
          "description": { "type": "string" },
          "properties": {
            "type": "array",
            "description": "ML-BOM extension properties for model metadata, agent identity, tool inventory, and risk assessment",
            "items": {
              "type": "object",
              "properties": {
                "name": { "type": "string" },
                "value": { "type": "string" }
              }
            }
          }
        },
        "required": ["type", "name"]
      }
    },
    "dependencies": {
      "type": "array",
      "items": {
        "type": "object",
        "properties": {
          "ref": { "type": "string" },
          "dependsOn": { "type": "array", "items": { "type": "string" } }
        },
        "required": ["ref"]
      }
    },
    "properties": {
      "type": "array",
      "description": "Top-level BOM properties (agent identity, risk summary, attestation)",
      "items": {
        "type": "object",
        "properties": {
          "name": { "type": "string" },
          "value": { "type": "string" }
        }
      }
    }
  }
}
